{
  "$schema": "s2-analysis-engine/schema/fixture/1",
  "schemaVersion": 1,
  "id": "placement-quad-partial-cancel",
  "rulesetId": "tetrio-s2-v19-foundation000000000000000000000000000000000000000000000000000000-beta-1-5-0",
  "evidenceLayer": "golden",
  "coverageCells": [
    "clear.lines",
    "attack.total",
    "attack.special-bonus",
    "rounding.mode",
    "cancel.fifo",
    "garbage.packet-model"
  ],
  "source": {
    "kind": "manual",
    "manual": {
      "author": "Claude Opus 5",
      "primarySource": "@haelp/teto 4.2.7 Board lock path and GarbageQueue.cancel",
      "rationale": "Promote the partial-cancel component golden to a board-derived transition: a four-line clear over garbage rows adds the special bonus, cancels one packet fully and the next partially, and carries the residual packet into the next canonical state with contiguous order."
    }
  },
  "input": {
    "state": {
      "$schema": "s2-analysis-engine/schema/canonical-state/1",
      "schemaVersion": 1,
      "rulesetId": "tetrio-s2-v19-foundation000000000000000000000000000000000000000000000000000000-beta-1-5-0",
      "board": {
        "width": 10,
        "height": 6,
        "cells": "GGGGGGGGG_GGGGGGGGG_GGGGGGGGG_GGGGGGGGG_G___________________",
        "fidelity": "exact"
      },
      "pieces": {
        "current": "I",
        "hold": null,
        "holdAvailable": true,
        "known": [
          "I",
          "T"
        ],
        "queueModel": {
          "type": "7-bag",
          "bagRemaining": [
            "S",
            "Z",
            "J",
            "L"
          ],
          "seed": null,
          "tail": "unknown"
        },
        "fidelity": "exact"
      },
      "chain": {
        "combo": 0,
        "b2b": 1,
        "fidelity": "exact"
      },
      "garbage": {
        "packets": [
          {
            "packetId": 30,
            "sourceGameId": 4401,
            "amount": 2,
            "holeSize": 1,
            "arrivalFrame": 100,
            "confirmed": true,
            "order": 0
          },
          {
            "packetId": 31,
            "sourceGameId": 4402,
            "amount": 6,
            "holeSize": 1,
            "arrivalFrame": 101,
            "confirmed": true,
            "order": 1
          }
        ],
        "generatorState": {
          "rngState": 123456789,
          "lastTankFrame": 90,
          "lastHoleColumn": -1,
          "sentForOpener": 0,
          "holeChanged": false,
          "receivedCountSinceReset": 0
        },
        "capState": {
          "consumedThisTick": 0
        },
        "fidelity": "exact"
      },
      "time": {
        "logicalFrame": 101,
        "frameSemantics": "virtual-tank-only",
        "piecesPlaced": 12,
        "fidelity": "exact"
      },
      "informationLoss": [],
      "provenance": {
        "sourcePath": "editor-session",
        "producedBy": "s2-analysis-engine-fixture"
      }
    },
    "action": {
      "kind": "placement",
      "placement": {
        "piece": "I",
        "rotation": "right",
        "x": 7,
        "y": 0,
        "usedHold": false,
        "rotationEvidence": {
          "lastInputWasRotation": false,
          "kickIndex": null
        }
      }
    }
  },
  "expected": {
    "legality": {
      "legal": true,
      "reason": null
    },
    "lockResult": {
      "clearedRows": [
        0,
        1,
        2,
        3
      ],
      "lines": 4,
      "spin": "none",
      "perfectClear": false
    },
    "chain": {
      "comboBefore": 0,
      "comboAfter": 1,
      "b2bBefore": 1,
      "b2bAfter": 2,
      "brokeB2b": false
    },
    "attackStages": {
      "raw": 5,
      "afterMultiplier": 5,
      "afterRounding": 6,
      "specialBonus": 1,
      "perfectClearBonus": 0,
      "surgeChunks": [],
      "outgoingBeforeCancel": 6
    },
    "cancelResult": {
      "cancelled": 6,
      "remainingIncoming": [
        {
          "packetId": 31,
          "sourceGameId": 4402,
          "amount": 2,
          "holeSize": 1,
          "arrivalFrame": 101,
          "confirmed": true,
          "order": 0
        }
      ],
      "outgoingAfterCancel": 0
    },
    "tankResult": {
      "inserted": [],
      "deferred": [
        {
          "packetId": 31,
          "sourceGameId": 4402,
          "amount": 2,
          "holeSize": 1,
          "arrivalFrame": 101,
          "confirmed": true,
          "order": 0
        }
      ],
      "toppedOut": false
    },
    "nextState": {
      "$schema": "s2-analysis-engine/schema/canonical-state/1",
      "schemaVersion": 1,
      "rulesetId": "tetrio-s2-v19-foundation000000000000000000000000000000000000000000000000000000-beta-1-5-0",
      "board": {
        "width": 10,
        "height": 6,
        "cells": "G___________________________________________________________",
        "fidelity": "exact"
      },
      "pieces": {
        "current": "I",
        "hold": null,
        "holdAvailable": true,
        "known": [
          "T"
        ],
        "queueModel": {
          "type": "7-bag",
          "bagRemaining": [
            "S",
            "Z",
            "J",
            "L"
          ],
          "seed": null,
          "tail": "unknown"
        },
        "fidelity": "exact"
      },
      "chain": {
        "combo": 1,
        "b2b": 2,
        "fidelity": "exact"
      },
      "garbage": {
        "packets": [
          {
            "packetId": 31,
            "sourceGameId": 4402,
            "amount": 2,
            "holeSize": 1,
            "arrivalFrame": 101,
            "confirmed": true,
            "order": 0
          }
        ],
        "generatorState": {
          "rngState": 469049721,
          "lastTankFrame": 90,
          "lastHoleColumn": -1,
          "sentForOpener": 0,
          "holeChanged": false,
          "receivedCountSinceReset": 0
        },
        "capState": {
          "consumedThisTick": 0
        },
        "fidelity": "exact"
      },
      "time": {
        "logicalFrame": 101,
        "frameSemantics": "virtual-tank-only",
        "piecesPlaced": 13,
        "fidelity": "exact"
      },
      "informationLoss": [],
      "provenance": {
        "sourcePath": "editor-session",
        "producedBy": "s2-analysis-engine-fixture"
      }
    }
  },
  "comparison": {
    "mode": "exact",
    "floatTolerance": 0
  },
  "generatedAt": "2026-08-13T00:00:00Z",
  "hash": "sha256:76886ea878103fce60e524dcfa5277fdb9e84b5a499bcb562e36bd665700f241"
}
