{
  "$schema": "s2-analysis-engine/schema/fixture/1",
  "schemaVersion": 1,
  "id": "placement-b2b-charging-surge",
  "rulesetId": "tetrio-s2-v19-b2bcharging00000000000000000000000000000000000000000000000000000-beta-1-5-0",
  "evidenceLayer": "golden",
  "coverageCells": [
    "b2b.exact",
    "b2b.charging-threshold",
    "b2b.surge-amount",
    "b2b.surge-split",
    "cancel.fifo"
  ],
  "source": {
    "kind": "manual",
    "manual": {
      "author": "Claude Opus 5",
      "primarySource": "@haelp/teto 4.2.7 Engine lock path and GarbageQueue.cancel",
      "rationale": "Promote the B2B charging / Surge component golden to a board-derived transition: an ordinary clear breaks a charged B2B chain, the Surge splits into three chunks, and those chunks cancel incoming garbage across a packet boundary."
    }
  },
  "input": {
    "state": {
      "$schema": "s2-analysis-engine/schema/canonical-state/1",
      "schemaVersion": 1,
      "rulesetId": "tetrio-s2-v19-b2bcharging00000000000000000000000000000000000000000000000000000-beta-1-5-0",
      "board": {
        "width": 10,
        "height": 6,
        "cells": "GGGG__GGGG__________________________________________________",
        "fidelity": "exact"
      },
      "pieces": {
        "current": "O",
        "hold": null,
        "holdAvailable": true,
        "known": [
          "I",
          "T"
        ],
        "queueModel": {
          "type": "7-bag",
          "bagRemaining": [
            "S",
            "Z",
            "J",
            "L"
          ],
          "seed": null,
          "tail": "unknown"
        },
        "fidelity": "exact"
      },
      "chain": {
        "combo": 0,
        "b2b": 6,
        "fidelity": "exact"
      },
      "garbage": {
        "packets": [
          {
            "packetId": 20,
            "sourceGameId": 4401,
            "amount": 1,
            "holeSize": 1,
            "arrivalFrame": 100,
            "confirmed": true,
            "order": 0
          },
          {
            "packetId": 21,
            "sourceGameId": 4402,
            "amount": 3,
            "holeSize": 1,
            "arrivalFrame": 100,
            "confirmed": true,
            "order": 1
          }
        ],
        "generatorState": {
          "rngState": 123456789,
          "lastTankFrame": 90,
          "lastHoleColumn": -1,
          "sentForOpener": 0,
          "holeChanged": false,
          "receivedCountSinceReset": 0
        },
        "capState": {
          "consumedThisTick": 0
        },
        "fidelity": "exact"
      },
      "time": {
        "logicalFrame": 101,
        "frameSemantics": "virtual-tank-only",
        "piecesPlaced": 12,
        "fidelity": "exact"
      },
      "informationLoss": [],
      "provenance": {
        "sourcePath": "editor-session",
        "producedBy": "s2-analysis-engine-fixture"
      }
    },
    "action": {
      "kind": "placement",
      "placement": {
        "piece": "O",
        "rotation": "spawn",
        "x": 4,
        "y": 0,
        "usedHold": false,
        "rotationEvidence": {
          "lastInputWasRotation": false,
          "kickIndex": null
        }
      }
    }
  },
  "expected": {
    "legality": {
      "legal": true,
      "reason": null
    },
    "lockResult": {
      "clearedRows": [
        0
      ],
      "lines": 1,
      "spin": "none",
      "perfectClear": false
    },
    "chain": {
      "comboBefore": 0,
      "comboAfter": 1,
      "b2bBefore": 6,
      "b2bAfter": 0,
      "brokeB2b": true
    },
    "attackStages": {
      "raw": 0,
      "afterMultiplier": 0,
      "afterRounding": 0,
      "specialBonus": 0,
      "perfectClearBonus": 0,
      "surgeChunks": [
        2,
        2,
        1
      ],
      "outgoingBeforeCancel": 5
    },
    "cancelResult": {
      "cancelled": 4,
      "remainingIncoming": [],
      "outgoingAfterCancel": 1
    },
    "tankResult": {
      "inserted": [],
      "deferred": [],
      "toppedOut": false
    },
    "nextState": {
      "$schema": "s2-analysis-engine/schema/canonical-state/1",
      "schemaVersion": 1,
      "rulesetId": "tetrio-s2-v19-b2bcharging00000000000000000000000000000000000000000000000000000-beta-1-5-0",
      "board": {
        "width": 10,
        "height": 6,
        "cells": "____OO______________________________________________________",
        "fidelity": "exact"
      },
      "pieces": {
        "current": "I",
        "hold": null,
        "holdAvailable": true,
        "known": [
          "T"
        ],
        "queueModel": {
          "type": "7-bag",
          "bagRemaining": [
            "S",
            "Z",
            "J",
            "L"
          ],
          "seed": null,
          "tail": "unknown"
        },
        "fidelity": "exact"
      },
      "chain": {
        "combo": 1,
        "b2b": 0,
        "fidelity": "exact"
      },
      "garbage": {
        "packets": [],
        "generatorState": {
          "rngState": 2053676357,
          "lastTankFrame": 90,
          "lastHoleColumn": -1,
          "sentForOpener": 1,
          "holeChanged": false,
          "receivedCountSinceReset": 0
        },
        "capState": {
          "consumedThisTick": 0
        },
        "fidelity": "exact"
      },
      "time": {
        "logicalFrame": 101,
        "frameSemantics": "virtual-tank-only",
        "piecesPlaced": 13,
        "fidelity": "exact"
      },
      "informationLoss": [],
      "provenance": {
        "sourcePath": "editor-session",
        "producedBy": "s2-analysis-engine-fixture"
      }
    }
  },
  "comparison": {
    "mode": "exact",
    "floatTolerance": 0
  },
  "generatedAt": "2026-08-13T00:00:00Z",
  "hash": "sha256:aca424dbc49f430fe3369f8ed736ed9d850b88a53c5d742119d1d06f7d6339e8"
}
