{
  "$schema": "s2-analysis-engine/schema/fixture/1",
  "schemaVersion": 1,
  "id": "placement-opener-phase-cancel",
  "rulesetId": "tetrio-s2-v19-opener-phase0000000000000000000000000000000000000000000000000000-beta-1-5-0",
  "evidenceLayer": "golden",
  "coverageCells": [
    "cancel.opener-phase",
    "cancel.fifo",
    "attack.total",
    "garbage.packet-model"
  ],
  "source": {
    "kind": "manual",
    "manual": {
      "author": "Claude Opus 5",
      "primarySource": "@haelp/teto 4.2.7 GarbageQueue#cancel",
      "rationale": "Fix the opener-phase branch: inside the phase an outgoing chunk drains incoming garbage twice over, so the same quad empties a queue that would otherwise keep two rows."
    }
  },
  "input": {
    "state": {
      "$schema": "s2-analysis-engine/schema/canonical-state/1",
      "schemaVersion": 1,
      "rulesetId": "tetrio-s2-v19-opener-phase0000000000000000000000000000000000000000000000000000-beta-1-5-0",
      "board": {
        "width": 10,
        "height": 10,
        "cells": "LLLLLLLLL_LLLLLLLLL_LLLLLLLLL_LLLLLLLLL_L___________________________________________________________",
        "fidelity": "exact"
      },
      "pieces": {
        "current": "I",
        "hold": null,
        "holdAvailable": true,
        "known": [
          "T",
          "O"
        ],
        "queueModel": {
          "type": "7-bag",
          "bagRemaining": [
            "S",
            "Z",
            "J"
          ],
          "seed": null,
          "tail": "unknown"
        },
        "fidelity": "exact"
      },
      "chain": {
        "combo": 0,
        "b2b": 0,
        "fidelity": "exact"
      },
      "garbage": {
        "packets": [
          {
            "packetId": 50,
            "sourceGameId": 4401,
            "amount": 4,
            "holeSize": 1,
            "arrivalFrame": 100,
            "confirmed": true,
            "order": 0
          },
          {
            "packetId": 51,
            "sourceGameId": 4402,
            "amount": 2,
            "holeSize": 1,
            "arrivalFrame": 101,
            "confirmed": true,
            "order": 1
          }
        ],
        "generatorState": {
          "rngState": 123456789,
          "lastTankFrame": 90,
          "lastHoleColumn": -1,
          "sentForOpener": 0,
          "holeChanged": false,
          "receivedCountSinceReset": 0
        },
        "capState": {
          "consumedThisTick": 0
        },
        "fidelity": "exact"
      },
      "time": {
        "logicalFrame": 101,
        "frameSemantics": "virtual-tank-only",
        "piecesPlaced": 5,
        "fidelity": "exact"
      },
      "informationLoss": [],
      "provenance": {
        "sourcePath": "editor-session",
        "producedBy": "s2-analysis-engine-fixture"
      }
    },
    "action": {
      "kind": "placement",
      "placement": {
        "piece": "I",
        "rotation": "right",
        "x": 7,
        "y": 0,
        "usedHold": false,
        "rotationEvidence": {
          "lastInputWasRotation": false,
          "kickIndex": null
        }
      }
    }
  },
  "expected": {
    "legality": {
      "legal": true,
      "reason": null
    },
    "lockResult": {
      "clearedRows": [
        0,
        1,
        2,
        3
      ],
      "lines": 4,
      "spin": "none",
      "perfectClear": false
    },
    "chain": {
      "comboBefore": 0,
      "comboAfter": 1,
      "b2bBefore": 0,
      "b2bAfter": 1,
      "brokeB2b": false
    },
    "attackStages": {
      "raw": 4,
      "afterMultiplier": 4,
      "afterRounding": 4,
      "specialBonus": 0,
      "perfectClearBonus": 0,
      "surgeChunks": [],
      "outgoingBeforeCancel": 4
    },
    "cancelResult": {
      "cancelled": 6,
      "remainingIncoming": [],
      "outgoingAfterCancel": 0
    },
    "tankResult": {
      "inserted": [],
      "deferred": [],
      "toppedOut": false
    },
    "nextState": {
      "$schema": "s2-analysis-engine/schema/canonical-state/1",
      "schemaVersion": 1,
      "rulesetId": "tetrio-s2-v19-opener-phase0000000000000000000000000000000000000000000000000000-beta-1-5-0",
      "board": {
        "width": 10,
        "height": 10,
        "cells": "L___________________________________________________________________________________________________",
        "fidelity": "exact"
      },
      "pieces": {
        "current": "T",
        "hold": null,
        "holdAvailable": true,
        "known": [
          "O"
        ],
        "queueModel": {
          "type": "7-bag",
          "bagRemaining": [
            "S",
            "Z",
            "J"
          ],
          "seed": null,
          "tail": "unknown"
        },
        "fidelity": "exact"
      },
      "chain": {
        "combo": 1,
        "b2b": 1,
        "fidelity": "exact"
      },
      "garbage": {
        "packets": [],
        "generatorState": {
          "rngState": 2053676357,
          "lastTankFrame": 90,
          "lastHoleColumn": -1,
          "sentForOpener": 0,
          "holeChanged": false,
          "receivedCountSinceReset": 0
        },
        "capState": {
          "consumedThisTick": 0
        },
        "fidelity": "exact"
      },
      "time": {
        "logicalFrame": 101,
        "frameSemantics": "virtual-tank-only",
        "piecesPlaced": 6,
        "fidelity": "exact"
      },
      "informationLoss": [],
      "provenance": {
        "sourcePath": "editor-session",
        "producedBy": "s2-analysis-engine-fixture"
      }
    }
  },
  "comparison": {
    "mode": "exact",
    "floatTolerance": 0
  },
  "generatedAt": "2026-08-13T00:00:00Z",
  "hash": "sha256:265842162ca711d258f6995d08234c46bdf2583bc607381cea2eda38f7139437"
}
