{
  "$schema": "s2-analysis-engine/schema/fixture/1",
  "schemaVersion": 1,
  "id": "placement-tspin-single",
  "rulesetId": "tetrio-s2-v19-foundation000000000000000000000000000000000000000000000000000000-beta-1-5-0",
  "evidenceLayer": "golden",
  "coverageCells": [
    "clear.lines",
    "spin.t-corner",
    "b2b.exact",
    "attack.special-bonus"
  ],
  "source": {
    "kind": "manual",
    "manual": {
      "author": "GPT-5",
      "primarySource": "@haelp/teto 4.2.7 Board lock and T-spin attack path",
      "rationale": "Connect canonical SRS rotation evidence to a T-spin single, B2B transition, staged attack, and the complete next canonical state."
    }
  },
  "input": {
    "state": {
      "$schema": "s2-analysis-engine/schema/canonical-state/1",
      "schemaVersion": 1,
      "rulesetId": "tetrio-s2-v19-foundation000000000000000000000000000000000000000000000000000000-beta-1-5-0",
      "board": {
        "width": 10,
        "height": 6,
        "cells": "___G_G____GGG___GGGG___G_G__________________________________",
        "fidelity": "exact"
      },
      "pieces": {
        "current": "T",
        "hold": null,
        "holdAvailable": true,
        "known": [
          "I",
          "T"
        ],
        "queueModel": {
          "type": "7-bag",
          "bagRemaining": [
            "S",
            "Z",
            "J",
            "L"
          ],
          "seed": null,
          "tail": "unknown"
        },
        "fidelity": "exact"
      },
      "chain": {
        "combo": 0,
        "b2b": 0,
        "fidelity": "exact"
      },
      "garbage": {
        "packets": [],
        "generatorState": {
          "rngState": 123456789,
          "lastTankFrame": 90,
          "lastHoleColumn": -1,
          "sentForOpener": 0,
          "holeChanged": false,
          "receivedCountSinceReset": 0
        },
        "capState": {
          "consumedThisTick": 0
        },
        "fidelity": "exact"
      },
      "time": {
        "logicalFrame": 101,
        "frameSemantics": "virtual-tank-only",
        "piecesPlaced": 0,
        "fidelity": "exact"
      },
      "informationLoss": [],
      "provenance": {
        "sourcePath": "editor-session",
        "producedBy": "s2-analysis-engine-fixture"
      }
    },
    "action": {
      "kind": "placement",
      "placement": {
        "piece": "T",
        "rotation": "spawn",
        "x": 3,
        "y": 0,
        "usedHold": false,
        "rotationEvidence": {
          "lastInputWasRotation": true,
          "kickIndex": 0,
          "kickId": "00",
          "kickOffset": [
            0,
            0
          ]
        }
      }
    }
  },
  "expected": {
    "legality": {
      "legal": true,
      "reason": null
    },
    "lockResult": {
      "clearedRows": [
        1
      ],
      "lines": 1,
      "spin": "normal",
      "perfectClear": false
    },
    "chain": {
      "comboBefore": 0,
      "comboAfter": 1,
      "b2bBefore": 0,
      "b2bAfter": 1,
      "brokeB2b": false
    },
    "attackStages": {
      "raw": 2,
      "afterMultiplier": 2,
      "afterRounding": 3,
      "specialBonus": 1,
      "perfectClearBonus": 0,
      "surgeChunks": [],
      "outgoingBeforeCancel": 3
    },
    "cancelResult": {
      "cancelled": 0,
      "remainingIncoming": [],
      "outgoingAfterCancel": 3
    },
    "tankResult": {
      "inserted": [],
      "deferred": [],
      "toppedOut": false
    },
    "nextState": {
      "$schema": "s2-analysis-engine/schema/canonical-state/1",
      "schemaVersion": 1,
      "rulesetId": "tetrio-s2-v19-foundation000000000000000000000000000000000000000000000000000000-beta-1-5-0",
      "board": {
        "width": 10,
        "height": 6,
        "cells": "___G_G_______GTG____________________________________________",
        "fidelity": "exact"
      },
      "pieces": {
        "current": "I",
        "hold": null,
        "holdAvailable": true,
        "known": [
          "T"
        ],
        "queueModel": {
          "type": "7-bag",
          "bagRemaining": [
            "S",
            "Z",
            "J",
            "L"
          ],
          "seed": null,
          "tail": "unknown"
        },
        "fidelity": "exact"
      },
      "chain": {
        "combo": 1,
        "b2b": 1,
        "fidelity": "exact"
      },
      "garbage": {
        "packets": [],
        "generatorState": {
          "rngState": 123456789,
          "lastTankFrame": 90,
          "lastHoleColumn": -1,
          "sentForOpener": 3,
          "holeChanged": false,
          "receivedCountSinceReset": 0
        },
        "capState": {
          "consumedThisTick": 0
        },
        "fidelity": "exact"
      },
      "time": {
        "logicalFrame": 101,
        "frameSemantics": "virtual-tank-only",
        "piecesPlaced": 1,
        "fidelity": "exact"
      },
      "informationLoss": [],
      "provenance": {
        "sourcePath": "editor-session",
        "producedBy": "s2-analysis-engine-fixture"
      }
    }
  },
  "comparison": {
    "mode": "exact",
    "floatTolerance": 0
  },
  "generatedAt": "2026-08-13T00:00:00Z",
  "hash": "sha256:260406919fdfbc0e94d350cfde2904bc04cc2a193d8e539393d534219ff4b714"
}
