{
  "$schema": "s2-analysis-engine/schema/fixture/1",
  "schemaVersion": 1,
  "id": "garbage-receive-same-frame-fifo",
  "rulesetId": "tetrio-s2-v19-foundation000000000000000000000000000000000000000000000000000000-beta-1-5-0",
  "evidenceLayer": "golden",
  "coverageCells": ["garbage.packet-model", "cancel.fifo"],
  "source": {
    "kind": "manual",
    "manual": {
      "author": "GPT-5",
      "primarySource": "schema/fixture.schema.json",
      "rationale": "Verify lossless packet insertion and same-frame FIFO ordering."
    }
  },
  "input": {
    "state": {
      "$schema": "s2-analysis-engine/schema/canonical-state/1",
      "schemaVersion": 1,
      "rulesetId": "tetrio-s2-v19-foundation000000000000000000000000000000000000000000000000000000-beta-1-5-0",
      "garbage": {
        "packets": [
          { "packetId": 10, "sourceGameId": 4401, "amount": 2, "holeSize": 1, "arrivalFrame": 100, "confirmed": false, "order": 0 }
        ],
        "generatorState": { "rngState": 123456789, "lastTankFrame": 90, "lastHoleColumn": 3, "sentForOpener": 2, "holeChanged": false, "receivedCountSinceReset": 1 },
        "capState": { "consumedThisTick": 0 },
        "fidelity": "exact"
      }
    },
    "action": {
      "kind": "garbage-receive",
      "packet": { "packetId": 11, "sourceGameId": 4402, "amount": 4, "holeSize": 1, "arrivalFrame": 100, "confirmed": true, "order": 1 }
    }
  },
  "expected": {
    "legality": { "legal": true, "reason": null },
    "lockResult": null,
    "chain": null,
    "attackStages": null,
    "cancelResult": null,
    "tankResult": null,
    "nextState": {
      "$schema": "s2-analysis-engine/schema/canonical-state/1",
      "schemaVersion": 1,
      "rulesetId": "tetrio-s2-v19-foundation000000000000000000000000000000000000000000000000000000-beta-1-5-0",
      "garbage": {
        "packets": [
          { "packetId": 10, "sourceGameId": 4401, "amount": 2, "holeSize": 1, "arrivalFrame": 100, "confirmed": false, "order": 0 },
          { "packetId": 11, "sourceGameId": 4402, "amount": 4, "holeSize": 1, "arrivalFrame": 100, "confirmed": true, "order": 1 }
        ],
        "generatorState": { "rngState": 123456789, "lastTankFrame": 90, "lastHoleColumn": 3, "sentForOpener": 2, "holeChanged": false, "receivedCountSinceReset": 1 },
        "capState": { "consumedThisTick": 0 },
        "fidelity": "exact"
      }
    }
  },
  "comparison": { "mode": "exact", "floatTolerance": 0 },
  "generatedAt": "2026-08-13T00:00:00Z",
  "hash": "sha256:2e3136f73cb44eeb3f7d596a6f36b8ce94b7df87b5e31048aed46fb46acba000"
}
